{
  "schema_version": 1,
  "id": "test.duplicate.ids",
  "name": "Duplicate IDs Test",
  "version": "0.1.0",
  "capabilities": [
    {
      "schema_version": 1,
      "id": "app.memory.write.mock",
      "name": "Memory Write A",
      "category": "app",
      "platforms": ["all"],
      "required_permissions": [],
      "approval_mode": "none",
      "data_sensitivity": "low",
      "reads": false,
      "writes": true,
      "network": false,
      "paid": false,
      "background": false,
      "replayable": true,
      "auditable": true,
      "mcp_exposable": false,
      "simulator_supported": true,
      "test_fixture_supported": true,
      "requires_trust": true,
      "requires_hitl": false,
      "metadata": {}
    },
    {
      "schema_version": 1,
      "id": "app.memory.write.mock",
      "name": "Memory Write B (DUPLICATE)",
      "category": "app",
      "platforms": ["all"],
      "required_permissions": [],
      "approval_mode": "none",
      "data_sensitivity": "low",
      "reads": false,
      "writes": true,
      "network": false,
      "paid": false,
      "background": false,
      "replayable": true,
      "auditable": true,
      "mcp_exposable": false,
      "simulator_supported": true,
      "test_fixture_supported": true,
      "requires_trust": true,
      "requires_hitl": false,
      "metadata": {}
    }
  ],
  "background_execution": false,
  "network_by_default": false,
  "simulator_mode": true
}
